{
  "format": "pixelart/1",
  "name": "Snowflake",
  "version": 1,
  "canvas": { "width": 16, "height": 16 },
  "frame_ms": 500,
  "palette": { "white": "#ffffff", "lightblue": "#8cefff" },
  "sprites": {
    "flake": {
      "points": {
        "white": [
          [7, 1],
          [5, 2],
          [9, 2],
          [6, 3],
          [7, 3],
          [8, 3],
          [7, 4],
          [2, 5],
          [12, 5],
          [3, 6],
          [7, 6],
          [11, 6],
          [1, 7],
          [4, 7],
          [3, 7],
          [6, 7],
          [8, 7],
          [10, 7],
          [11, 7],
          [13, 7],
          [3, 8],
          [7, 8],
          [11, 8],
          [2, 9],
          [12, 9],
          [7, 10],
          [6, 11],
          [7, 11],
          [8, 11],
          [5, 12],
          [9, 12],
          [7, 13]
        ],
        "lightblue": [
          [7, 2],
          [4, 4],
          [10, 4],
          [5, 5],
          [7, 5],
          [9, 5],
          [6, 6],
          [8, 6],
          [2, 7],
          [5, 7],
          [7, 7],
          [9, 7],
          [12, 7],
          [6, 8],
          [8, 8],
          [5, 9],
          [7, 9],
          [9, 9],
          [4, 10],
          [10, 10],
          [7, 12]
        ]
      }
    }
  },
  "timeline": [
    {
      "loop": 5,
      "steps": [{ "show": ["flake"] }, { "show": ["flake"], "recolor": { "lightblue": "white", "white": "lightblue" } }]
    }
  ]
}
