{
  "format": "pixelart/1",
  "name": "Elf",
  "version": 1,
  "canvas": {
    "width": 16,
    "height": 16
  },
  "frame_ms": 500,
  "palette": {
    "main": "#4eb013"
  },
  "sprites": {
    "shape": {
      "points": {
        "main": [
          [7, 2],
          [6, 3],
          [8, 3],
          [7, 4],
          [6, 6],
          [8, 6],
          [5, 8],
          [9, 8]
        ]
      }
    }
  },
  "timeline": [
    {
      "show": ["shape"]
    }
  ]
}
