{
  "format": "pixelart/1",
  "name": "Ball",
  "version": 1,
  "canvas": { "width": 16, "height": 16 },
  "frame_ms": 500,
  "palette": { "gold": "#bf9000", "teal": "#069f84", "red": "#ff0000", "white": "#ffffff" },
  "sprites": {
    "ball": {
      "points": {
        "gold": [
          [7, 0],
          [8, 0],
          [7, 1],
          [8, 1],
          [6, 2],
          [7, 2],
          [8, 2],
          [9, 2],
          [6, 3],
          [7, 3],
          [8, 3],
          [9, 3]
        ],
        "teal": [
          [5, 4],
          [6, 4],
          [7, 4],
          [8, 4],
          [9, 4],
          [10, 4],
          [4, 5],
          [5, 5],
          [6, 5],
          [7, 5],
          [8, 5],
          [9, 5],
          [10, 5],
          [11, 5],
          [3, 6],
          [4, 6],
          [5, 6],
          [6, 6],
          [7, 6],
          [8, 6],
          [9, 6],
          [10, 6],
          [11, 6],
          [12, 6],
          [3, 7],
          [4, 7],
          [5, 7],
          [7, 7],
          [8, 7],
          [9, 7],
          [11, 7],
          [12, 7],
          [13, 7],
          [4, 8],
          [8, 8],
          [12, 8],
          [2, 11],
          [6, 11],
          [10, 11],
          [2, 12],
          [3, 12],
          [5, 12],
          [6, 12],
          [7, 12],
          [9, 12],
          [10, 12],
          [11, 12],
          [13, 12],
          [3, 13],
          [4, 13],
          [5, 13],
          [6, 13],
          [7, 13],
          [8, 13],
          [9, 13],
          [10, 13],
          [11, 13],
          [12, 13],
          [4, 14],
          [5, 14],
          [6, 14],
          [7, 14],
          [8, 14],
          [9, 14],
          [10, 14],
          [11, 14],
          [5, 15],
          [6, 15],
          [7, 15],
          [8, 15],
          [9, 15],
          [10, 15]
        ],
        "white": [
          [2, 7],
          [6, 7],
          [10, 7],
          [3, 8],
          [5, 8],
          [7, 8],
          [9, 8],
          [11, 8],
          [13, 8],
          [4, 9],
          [8, 9],
          [12, 9],
          [2, 10],
          [6, 10],
          [10, 10],
          [3, 11],
          [5, 11],
          [7, 11],
          [9, 11],
          [11, 11],
          [13, 11],
          [4, 12],
          [8, 12],
          [12, 12]
        ],
        "red": [
          [2, 8],
          [6, 8],
          [10, 8],
          [2, 9],
          [3, 9],
          [5, 9],
          [6, 9],
          [7, 9],
          [9, 9],
          [10, 9],
          [11, 9],
          [13, 9],
          [3, 10],
          [4, 10],
          [5, 10],
          [7, 10],
          [8, 10],
          [9, 10],
          [11, 10],
          [12, 10],
          [13, 10],
          [4, 11],
          [8, 11],
          [12, 11]
        ]
      }
    },
    "turn_1": {
      "points": {
        "teal": [
          [2, 7],
          [4, 7],
          [5, 7],
          [6, 7],
          [8, 7],
          [9, 7],
          [10, 7],
          [12, 7],
          [13, 7],
          [5, 8],
          [9, 8],
          [13, 8],
          [3, 11],
          [7, 11],
          [11, 11],
          [2, 12],
          [3, 12],
          [4, 12],
          [6, 12],
          [7, 12],
          [8, 12],
          [10, 12],
          [11, 12],
          [12, 12]
        ],
        "white": [
          [3, 7],
          [7, 7],
          [11, 7],
          [2, 8],
          [4, 8],
          [6, 8],
          [8, 8],
          [10, 8],
          [12, 8],
          [5, 9],
          [9, 9],
          [13, 9],
          [3, 10],
          [7, 10],
          [11, 10],
          [2, 11],
          [4, 11],
          [6, 11],
          [8, 11],
          [10, 11],
          [12, 11],
          [5, 12],
          [9, 12],
          [13, 12]
        ],
        "red": [
          [3, 8],
          [7, 8],
          [11, 8],
          [2, 9],
          [3, 9],
          [4, 9],
          [6, 9],
          [7, 9],
          [8, 9],
          [10, 9],
          [11, 9],
          [12, 9],
          [2, 10],
          [4, 10],
          [5, 10],
          [6, 10],
          [8, 10],
          [9, 10],
          [10, 10],
          [12, 10],
          [13, 10],
          [5, 11],
          [9, 11],
          [13, 11]
        ]
      }
    },
    "turn_2": {
      "points": {
        "teal": [
          [2, 7],
          [3, 7],
          [5, 7],
          [6, 7],
          [7, 7],
          [9, 7],
          [10, 7],
          [11, 7],
          [13, 7],
          [2, 8],
          [6, 8],
          [10, 8],
          [4, 11],
          [8, 11],
          [12, 11],
          [3, 12],
          [4, 12],
          [5, 12],
          [7, 12],
          [8, 12],
          [9, 12],
          [11, 12],
          [12, 12],
          [13, 12]
        ],
        "white": [
          [4, 7],
          [8, 7],
          [12, 7],
          [3, 8],
          [5, 8],
          [7, 8],
          [9, 8],
          [11, 8],
          [13, 8],
          [2, 9],
          [6, 9],
          [10, 9],
          [4, 10],
          [8, 10],
          [12, 10],
          [3, 11],
          [5, 11],
          [7, 11],
          [9, 11],
          [11, 11],
          [13, 11],
          [2, 12],
          [6, 12],
          [10, 12]
        ],
        "red": [
          [4, 8],
          [8, 8],
          [12, 8],
          [3, 9],
          [4, 9],
          [5, 9],
          [7, 9],
          [8, 9],
          [9, 9],
          [11, 9],
          [12, 9],
          [13, 9],
          [2, 10],
          [3, 10],
          [5, 10],
          [6, 10],
          [7, 10],
          [9, 10],
          [10, 10],
          [11, 10],
          [13, 10],
          [2, 11],
          [6, 11],
          [10, 11]
        ]
      }
    },
    "turn_3": {
      "points": {
        "teal": [
          [2, 7],
          [3, 7],
          [4, 7],
          [6, 7],
          [7, 7],
          [8, 7],
          [10, 7],
          [11, 7],
          [12, 7],
          [3, 8],
          [7, 8],
          [11, 8],
          [5, 11],
          [9, 11],
          [13, 11],
          [2, 12],
          [4, 12],
          [5, 12],
          [6, 12],
          [8, 12],
          [9, 12],
          [10, 12],
          [12, 12],
          [13, 12]
        ],
        "white": [
          [5, 7],
          [9, 7],
          [13, 7],
          [2, 8],
          [4, 8],
          [6, 8],
          [8, 8],
          [10, 8],
          [12, 8],
          [3, 9],
          [7, 9],
          [11, 9],
          [5, 10],
          [9, 10],
          [13, 10],
          [2, 11],
          [4, 11],
          [6, 11],
          [8, 11],
          [10, 11],
          [12, 11],
          [3, 12],
          [7, 12],
          [11, 12]
        ],
        "red": [
          [5, 8],
          [9, 8],
          [13, 8],
          [2, 9],
          [4, 9],
          [5, 9],
          [6, 9],
          [8, 9],
          [9, 9],
          [10, 9],
          [12, 9],
          [13, 9],
          [2, 10],
          [3, 10],
          [4, 10],
          [6, 10],
          [7, 10],
          [8, 10],
          [10, 10],
          [11, 10],
          [12, 10],
          [3, 11],
          [7, 11],
          [11, 11]
        ]
      }
    }
  },
  "timeline": [
    {
      "loop": 3,
      "steps": [
        { "show": ["ball"] },
        { "show": ["ball", "turn_1"] },
        { "show": ["ball", "turn_2"] },
        { "show": ["ball", "turn_3"] }
      ]
    }
  ]
}
