{
  "format": "pixelart/1",
  "name": "Sleigh",
  "version": 1,
  "canvas": {
    "width": 16,
    "height": 16
  },
  "frame_ms": 500,
  "palette": {
    "main": "#c141f2"
  },
  "sprites": {
    "shape": {
      "points": {
        "main": [
          [3, 9],
          [4, 9],
          [5, 9],
          [10, 9],
          [11, 9],
          [12, 9],
          [4, 10],
          [11, 10]
        ]
      }
    }
  },
  "timeline": [
    {
      "show": ["shape"]
    }
  ]
}
