{
  "format": "pixelart/1",
  "name": "Bear",
  "version": 1,
  "canvas": { "width": 16, "height": 16 },
  "frame_ms": 500,
  "palette": {
    "red": "#ff0000",
    "white": "#ffffff",
    "lightblue": "#8cefff",
    "blue": "#042b69",
    "darkgrey": "#666666",
    "pink": "#f463a6"
  },
  "sprites": {
    "bear": {
      "points": {
        "lightblue": [
          [3, 5],
          [4, 5],
          [5, 5],
          [6, 5],
          [7, 5],
          [8, 5],
          [9, 5],
          [10, 5],
          [11, 5],
          [1, 6],
          [2, 6],
          [3, 6],
          [11, 6],
          [12, 6],
          [13, 6],
          [0, 7],
          [2, 7],
          [12, 7],
          [14, 7],
          [0, 8],
          [14, 8],
          [1, 9],
          [13, 9],
          [1, 10],
          [13, 10],
          [0, 11],
          [14, 11],
          [0, 12],
          [14, 12],
          [0, 13],
          [14, 13],
          [1, 14],
          [2, 14],
          [3, 14],
          [11, 14],
          [12, 14],
          [13, 14],
          [3, 15],
          [4, 15],
          [5, 15],
          [6, 15],
          [7, 15],
          [8, 15],
          [9, 15],
          [10, 15],
          [11, 15]
        ],
        "blue": [
          [4, 10],
          [10, 10]
        ],
        "darkgrey": [
          [6, 10],
          [7, 10],
          [8, 10],
          [7, 11],
          [7, 12]
        ],
        "pink": [
          [3, 11],
          [11, 11]
        ],
        "white": [
          [4, 6],
          [5, 6],
          [6, 6],
          [7, 6],
          [8, 6],
          [9, 6],
          [10, 6],
          [1, 7],
          [3, 7],
          [4, 7],
          [5, 7],
          [6, 7],
          [7, 7],
          [8, 7],
          [9, 7],
          [10, 7],
          [11, 7],
          [13, 7],
          [1, 8],
          [2, 8],
          [3, 8],
          [4, 8],
          [5, 8],
          [6, 8],
          [7, 8],
          [8, 8],
          [9, 8],
          [10, 8],
          [11, 8],
          [12, 8],
          [13, 8],
          [2, 9],
          [3, 9],
          [4, 9],
          [5, 9],
          [6, 9],
          [7, 9],
          [8, 9],
          [9, 9],
          [10, 9],
          [11, 9],
          [12, 9],
          [2, 10],
          [3, 10],
          [5, 10],
          [9, 10],
          [11, 10],
          [12, 10],
          [1, 11],
          [2, 11],
          [4, 11],
          [5, 11],
          [6, 11],
          [8, 11],
          [9, 11],
          [10, 11],
          [12, 11],
          [13, 11],
          [1, 12],
          [2, 12],
          [3, 12],
          [4, 12],
          [5, 12],
          [6, 12],
          [8, 12],
          [9, 12],
          [10, 12],
          [11, 12],
          [12, 12],
          [13, 12],
          [1, 13],
          [2, 13],
          [3, 13],
          [4, 13],
          [5, 13],
          [6, 13],
          [7, 13],
          [8, 13],
          [9, 13],
          [10, 13],
          [11, 13],
          [12, 13],
          [13, 13],
          [4, 14],
          [5, 14],
          [6, 14],
          [7, 14],
          [8, 14],
          [9, 14],
          [10, 14]
        ]
      }
    },
    "hat": {
      "points": {
        "white": [
          [14, 2],
          [15, 2],
          [14, 3],
          [15, 3],
          [3, 4],
          [4, 4],
          [5, 4],
          [6, 4],
          [7, 4],
          [8, 4],
          [9, 4],
          [10, 4],
          [11, 4]
        ],
        "pink": [
          [2, 11],
          [2, 12],
          [3, 12],
          [12, 11],
          [11, 12],
          [12, 12]
        ],
        "red": [
          [5, 0],
          [6, 0],
          [7, 0],
          [8, 0],
          [9, 0],
          [10, 0],
          [11, 0],
          [12, 0],
          [4, 1],
          [5, 1],
          [6, 1],
          [7, 1],
          [8, 1],
          [9, 1],
          [10, 1],
          [13, 1],
          [4, 2],
          [5, 2],
          [6, 2],
          [7, 2],
          [8, 2],
          [9, 2],
          [10, 2],
          [3, 3],
          [4, 3],
          [5, 3],
          [6, 3],
          [7, 3],
          [8, 3],
          [9, 3],
          [10, 3],
          [11, 3]
        ]
      }
    }
  },
  "timeline": [{ "loop": 5, "steps": [{ "show": ["bear"] }, { "show": ["bear", "hat"] }] }]
}
