{
  "format": "pixelart/1",
  "name": "Wreath",
  "version": 1,
  "canvas": { "width": 16, "height": 16 },
  "frame_ms": 500,
  "palette": { "white": "#ffffff", "red": "#ff0000", "green": "#4eb013", "darkgreen": "#025d4d" },
  "sprites": {
    "wreath": {
      "points": {
        "green": [
          [5, 0],
          [6, 0],
          [7, 0],
          [9, 0],
          [10, 0],
          [3, 1],
          [4, 1],
          [5, 1],
          [6, 1],
          [8, 1],
          [9, 1],
          [3, 2],
          [4, 2],
          [5, 2],
          [7, 2],
          [8, 2],
          [3, 3],
          [4, 3],
          [5, 3],
          [7, 3],
          [12, 3],
          [13, 3],
          [14, 3],
          [4, 4],
          [5, 4],
          [10, 4],
          [11, 4],
          [12, 4],
          [13, 4],
          [14, 4],
          [0, 5],
          [4, 5],
          [11, 5],
          [12, 5],
          [13, 5],
          [14, 5],
          [15, 5],
          [0, 6],
          [1, 6],
          [14, 6],
          [15, 6],
          [1, 7],
          [2, 7],
          [12, 7],
          [13, 7],
          [15, 7],
          [0, 8],
          [2, 8],
          [3, 8],
          [13, 8],
          [14, 8],
          [0, 9],
          [1, 9],
          [14, 9],
          [15, 9],
          [0, 10],
          [1, 10],
          [2, 10],
          [3, 10],
          [4, 10],
          [11, 10],
          [15, 10],
          [1, 11],
          [2, 11],
          [3, 11],
          [4, 11],
          [5, 11],
          [10, 11],
          [11, 11],
          [1, 12],
          [2, 12],
          [3, 12],
          [8, 12],
          [10, 12],
          [11, 12],
          [12, 12],
          [7, 13],
          [8, 13],
          [10, 13],
          [11, 13],
          [12, 13],
          [6, 14],
          [7, 14],
          [9, 14],
          [10, 14],
          [11, 14],
          [12, 14],
          [5, 15],
          [6, 15],
          [8, 15],
          [9, 15],
          [10, 15]
        ],
        "darkgreen": [
          [8, 0],
          [7, 1],
          [2, 2],
          [6, 2],
          [12, 2],
          [13, 2],
          [2, 3],
          [6, 3],
          [10, 3],
          [11, 3],
          [3, 4],
          [3, 5],
          [12, 6],
          [13, 6],
          [0, 7],
          [14, 7],
          [1, 8],
          [15, 8],
          [2, 9],
          [3, 9],
          [12, 10],
          [12, 11],
          [4, 12],
          [5, 12],
          [9, 12],
          [13, 12],
          [2, 13],
          [3, 13],
          [9, 13],
          [13, 13],
          [8, 14],
          [7, 15]
        ],
        "red": [
          [10, 1],
          [11, 1],
          [12, 1],
          [9, 2],
          [10, 2],
          [11, 2],
          [8, 3],
          [9, 3],
          [1, 3],
          [1, 4],
          [2, 4],
          [1, 5],
          [2, 5],
          [2, 6],
          [3, 6],
          [3, 7],
          [12, 8],
          [12, 9],
          [13, 9],
          [13, 10],
          [14, 10],
          [13, 11],
          [14, 11],
          [6, 12],
          [7, 12],
          [14, 12],
          [4, 13],
          [5, 13],
          [6, 13],
          [3, 14],
          [4, 14],
          [5, 14]
        ]
      }
    },
    "lights": {
      "points": {
        "white": [
          [7, 0],
          [4, 1],
          [9, 1],
          [4, 4],
          [11, 4],
          [14, 4],
          [1, 6],
          [15, 7],
          [0, 8],
          [14, 9],
          [1, 11],
          [4, 11],
          [11, 11],
          [6, 14],
          [11, 14],
          [8, 15]
        ]
      }
    }
  },
  "timeline": [
    { "loop": 4, "steps": [{ "show": ["wreath"] }, { "show": ["wreath", "lights"] }] },
    { "show": ["wreath"] }
  ]
}
