{
  "format": "pixelart/1",
  "name": "test",
  "canvas": {
    "width": 16,
    "height": 16
  },
  "palette": {
    "red": "#ff0000"
  },
  "sprites": {
    "a": {
      "at": [
        1,
        1
      ],
      "points": [
        [
          0,
          0,
          "red"
        ],
        [
          1,
          0,
          "#00ff00"
        ]
      ]
    },
    "b": {
      "points": {
        "red": [
          [
            5,
            5
          ]
        ],
        "#0000ff": [
          [
            6,
            5
          ],
          [
            7,
            5
          ]
        ]
      }
    }
  },
  "timeline": [
    {
      "show": [
        "a",
        "b"
      ]
    }
  ]
}